{
  "slug": "neuromuscular-contraction",
  "category": "veterinary",
  "title": "How a Nerve Impulse Triggers Muscle Contraction",
  "theme": "veterinary",
  "default_variant": "how-it-works",
  "notion": {
    "required": true,
    "location_hint": "Veterinary stuff -> visualisations"
  },
  "embed": {
    "mode": "bounded",
    "recommended_height_px": 1040,
    "flexible": false
  },
  "variants": [
    {
      "slug": "how-it-works",
      "title": "How a Nerve Impulse Triggers Muscle Contraction",
      "path": "./how-it-works/"
    }
  ]
}
